[
  {
    "network": "studio-dev",
    "chainId": 61997,
    "contractName": "ProviderStubA",
    "contractAddress": "0xf86C3762735eEc9e20CD890Dc3872Fd267592b96",
    "deploymentTxId": "0x6b3cc180f664eb5021f26773067acf49a7089926cfe2f66fcbe73de2cf996ce5",
    "deployerAddress": "0x24fae7cd031ed702be63bdea8912141805b996bd",
    "sourceCommit": "74122cbe55e9c9db0a80229ad51240f3ca028a2f",
    "runnerDependency": "py-genlayer:5jycge4q8k23462jtb0b9fyey1s9qz928sz2nbrd9mg4sxqg2qng",
    "constructorArgs": [],
    "policyVersion": null,
    "feeDepositWei": "500000000000000000",
    "deployedAt": "2026-09-10T00:00:00Z",
    "lifecycleStatus": "FINALIZED",
    "executionResult": "FINISHED_WITH_RETURN"
  },
  {
    "network": "studio-dev",
    "chainId": 61997,
    "contractName": "ProviderStubB",
    "contractAddress": "0xcb0d07d53914249704df2800E339b632047adD6f",
    "deploymentTxId": "0xd793cf577aede7532113e10d0f0bba0572780eb53aa666773176f22c36ffa7e2",
    "deployerAddress": "0x24fae7cd031ed702be63bdea8912141805b996bd",
    "sourceCommit": "74122cbe55e9c9db0a80229ad51240f3ca028a2f",
    "runnerDependency": "py-genlayer:5jycge4q8k23462jtb0b9fyey1s9qz928sz2nbrd9mg4sxqg2qng",
    "constructorArgs": [],
    "policyVersion": null,
    "feeDepositWei": "500000000000000000",
    "deployedAt": "2026-09-10T00:00:00Z",
    "lifecycleStatus": "FINALIZED",
    "executionResult": "FINISHED_WITH_RETURN"
  },
  {
    "network": "studio-dev",
    "chainId": 61997,
    "contractName": "AssuranceKernel",
    "contractAddress": "0x6f6b52bc5Bd8040c46d8a3eaAA42a49888eCd647",
    "deploymentTxId": "0x8905babe90011583870fbae35628f68f23094b4676247d68b170a6b9454cad05",
    "deployerAddress": "0x24fae7cd031ed702be63bdea8912141805b996bd",
    "sourceCommit": "74122cbe55e9c9db0a80229ad51240f3ca028a2f",
    "runnerDependency": "py-genlayer:5jycge4q8k23462jtb0b9fyey1s9qz928sz2nbrd9mg4sxqg2qng",
    "constructorArgs": [1, 60],
    "policyVersion": null,
    "feeDepositWei": "800000000000000000",
    "deployedAt": "2026-09-10T00:00:00Z",
    "lifecycleStatus": "FINALIZED",
    "executionResult": "FINISHED_WITH_RETURN"
  },
  {
    "network": "studio-dev",
    "chainId": 61997,
    "contractName": "ReferenceAgentProtocol",
    "contractAddress": "0xeE850E45e240bB2864088887fB6Eb7c203b0F9Ed",
    "deploymentTxId": "0x4355812153e736013c46de39ab9ee20cfb874f99d3592023a4930ceb67c25a13",
    "deployerAddress": "0x24fae7cd031ed702be63bdea8912141805b996bd",
    "sourceCommit": "74122cbe55e9c9db0a80229ad51240f3ca028a2f",
    "runnerDependency": "py-genlayer:5jycge4q8k23462jtb0b9fyey1s9qz928sz2nbrd9mg4sxqg2qng",
    "constructorArgs": [
      "0x24fae7cd031ed702be63bdea8912141805b996bd",
      "reclose-target-001",
      "0xf86C3762735eEc9e20CD890Dc3872Fd267592b96",
      "0xcb0d07d53914249704df2800E339b632047adD6f",
      "1000000000000000000",
      "100000000000000000",
      true
    ],
    "policyVersion": null,
    "feeDepositWei": "800000000000000000",
    "deployedAt": "2026-09-10T00:00:00Z",
    "lifecycleStatus": "FINALIZED",
    "executionResult": "FINISHED_WITH_RETURN"
  }
]
